How to Augment the Training Set using the tf.keras.utils.Sequence API?,"<python>, <tensorflow>, <keras>",63851431,403,-1,2020-09-11T17:04:51.857,2020-09-11T18:50:50.650,"augment train d,ds,d"
How to perform sklearn style train-test split on feature and label tensors using built in tensorflow methods?,"<tensorflow>, <tensorflow2.0>, <train-test-split>",63965968,137,0,2020-09-19T06:33:44.473,2020-09-19T07:10:11.923,"split train/test d,ds,d"
How to create mini-batches using tensorflow.data.experimental.CsvDataset compatible with model's input shape?,"<python>, <tensorflow>, <keras>, <tensorflow2.0>, <tensorflow-datasets>",64075650,330,0,2020-09-26T08:48:09.007,2020-09-26T16:12:16.437,"create,db,d"
How to predict on new data using a trained and saved Feedforward NN,"<python>, <tensorflow>, <machine-learning>, <keras>, <neural-network>",64101808,217,1,2020-09-28T12:02:25.987,2020-09-28T12:12:11.370,"test feed forward,model,p"
How to train a CNN on a cluster of GPUs (multi-gpu)?,"<python>, <tensorflow>, <cluster-computing>, <multi-gpu>",64185460,279,1,2020-10-03T14:46:35.493,2020-10-06T15:18:47.353,"use multiple,gpu,r"
How to mix trainable and non trainable weight inside a same layer in tf.keras,"<tensorflow>, <keras>",64576266,485,0,2020-10-28T15:38:50.930,2020-10-29T13:39:08.270,"merge,weight,m"
"How to split dataset into (X_train, y_train), (X_test, y_test)?","<python>, <tensorflow>, <keras>, <scikit-learn>",64646247,709,0,2020-11-02T13:11:49.907,2020-11-02T13:18:18.387,"split train/test d,ds,d"
How to extract validation data from training data,"<python>, <tensorflow>, <keras>",64750914,107,0,2020-11-09T11:37:38.320,2020-11-09T20:24:21.943,"split train/valid d,ds,d"
Train model in Pytorch with custom loss how to set up optimizer and run training?,"<python>, <pytorch>, <loss>, <inference>, <custom-training>",64779266,267,0,2020-11-11T01:38:30.657,2020-11-11T03:35:16.527,"train,model,t"
How to load TensorFlow Keras model from a saved checkpoint in Colaboratory?,"<python>, <tensorflow>, <keras>, <google-colaboratory>",64844839,68,0,2020-11-15T13:15:09.913,2020-11-15T14:12:05.593,"restore,trained model,m"
How to use distributed training with a custom loss using Tensorflow?,"<python>, <tensorflow>, <keras>, <distributed-computing>",64846130,185,0,2020-11-15T15:18:00.430,2020-11-16T02:12:14.640,"compute,loss,m"
How to upload my training data into google for Tensorflow cloud training,"<python>, <tensorflow>, <google-app-engine>, <google-cloud-platform>, <gcp-ai-platform-training>",65053253,128,0,2020-11-28T18:41:49.767,2020-11-29T20:05:27.260,"feed data,model,m"
Keras: how to modify input of keras model while training for every batch,"<python>, <tensorflow>, <keras>, <tensorflow2.0>",65103165,51,0,2020-12-02T06:20:22.107,2020-12-02T08:22:56.100,"change input for epoch,model,t"
How to print a tensor every epoch,"<tensorflow>, <keras>, <tensorflow2.0>",65136338,276,0,2020-12-04T00:42:06.387,2020-12-04T02:56:04.807,"display dv,data,v"
Tensorflow 2.3. How to change the batch for each epoch?,"<python>, <tensorflow>, <tensorflow2.0>",65142786,89,0,2020-12-04T11:30:22.123,2020-12-04T13:39:08.010,"change for epoch,batch,t"
How to concatenate 2 pytorch models and make the first one non-trainable in PyTorch,"<python>, <pytorch>, <pre-trained-model>",65216411,1331,0,2020-12-09T12:03:19.683,2020-12-09T12:07:25.683,"combine,model,m"
How to add a multiclass multilabel layer on top of trained BERT model?,"<deep-learning>, <pytorch>, <bert-language-model>, <huggingface-transformers>, <transfer-learning>",65285054,883,0,2020-12-14T07:22:16.973,2020-12-16T23:22:46.610,"add layer,bert trained model,m"
How to check if a model is in train or eval mode in Pytorch?,"<python>, <machine-learning>, <deep-learning>, <pytorch>",65344578,879,6,2020-12-17T16:27:34.207,2020-12-17T16:27:34.207,"check train/eval mode,training progress,t"
How to get the loss for each epoch in custom batch training in Keras?,"<python>, <tensorflow>, <machine-learning>, <keras>, <deep-learning>",65467299,247,3,2020-12-27T15:23:03.700,2020-12-27T15:48:27.750,"get,loss,t"
How to place custom layer inside a in-built pre trained model?,"<python>, <tensorflow>, <keras>, <deep-learning>",65477554,192,1,2020-12-28T12:23:00.183,2020-12-29T03:51:49.090,"add layer,trained model,m"
how to run apply_gradients for more than one trainable_weight in TensorFlow 2.0,"<tensorflow>, <keras>, <tensorflow2.0>, <tensorflow2.x>",65531899,44,0,2021-01-01T17:18:40.783,2021-01-02T06:52:52.673,"update,weight,t"
How to make a prediction on this trained model?,"<python>, <tensorflow>, <machine-learning>, <keras>, <deep-learning>",65535101,113,0,2021-01-02T00:50:35.600,2021-01-02T05:29:42.223,"test,model,p"
How to shuffle the batches themselves in pytorch?,"<python>, <random>, <pytorch-dataloader>",65554711,575,-1,2021-01-03T20:40:51.300,2021-01-03T21:28:15.030,"shuffle,db,d"
Keras: how to change random number every epoch?,"<tensorflow>, <keras>, <tensorflow2.0>",65605345,139,0,2021-01-07T01:07:02.343,2021-01-07T01:16:18.557,"change random number,training progress,t"
How to extract cell state of LSTM model through model.fit()?,"<python-3.x>, <tensorflow>, <keras>, <lstm>",65654159,28,0,2021-01-10T14:07:36.137,2021-01-10T14:21:06.127,"get weight,lstm model,m"
How to train a neural network twice without re-initialize the model?,"<python>, <tensorflow>, <machine-learning>, <keras>, <deep-learning>",65693459,59,1,2021-01-12T23:16:45.190,2021-01-12T23:57:45.203,"train,model,t"
How to load a trained model to inference the predicted data,"<python>, <validation>, <pytorch>, <conv-neural-network>, <prediction>",65838180,28,0,2021-01-22T01:33:01.470,2021-01-22T16:23:14.090,"test,model,p"
How to shuffle batches with ImageDataGenerator?,"<python>, <tensorflow>, <keras>",65942274,61,0,2021-01-28T17:30:32.437,2021-01-28T18:55:55.927,"shuffle,db,d"
How to visualize training process with output per patch/epoch?,"<python>, <tensorflow>, <keras>, <plot>, <neural-network>",66048377,52,1,2021-02-04T15:11:41.203,2021-02-04T15:29:05.337,"print training progress,progress,v"
How to train with a dataset of images where the labels are also images?,"<tensorflow>, <keras>, <deep-learning>",66213482,50,1,2021-02-15T18:30:41.527,2021-02-16T09:35:07.367,"train,model,t"
How to split the dataset into train and test based on client number using &quot;Federated learning&quot;,"<python>, <tensorflow>, <federated-learning>",66289113,33,0,2021-02-20T07:32:33.450,2021-02-20T11:44:59.160,"split train/test d,ds,d"
Torch: How to inspect weight after training?,"<python>, <pytorch>",66393460,28,0,2021-02-26T22:17:44.180,2021-02-27T00:07:22.287,"get,trained weight,m"
How to find training accuracy in pytorch,"<python>, <pytorch>, <conv-neural-network>",66443620,215,2,2021-03-02T16:48:47.600,2021-04-16T17:08:21.127,"compute for training,accuracy,e"
Tensorflow Serving: How to re train a model that is currently served in production using tensorflow serving?,"<tensorflow>, <tensorflow-serving>",66598598,87,1,2021-03-12T10:56:01.430,2021-03-18T11:42:10.950,"train,model,t"
How to read predict() result in Tensorflowjs using a SavedModel,"<node.js>, <tensorflow>, <object-detection>, <tensorflow.js>, <efficientnet>",66772446,95,1,2021-03-23T22:56:41.583,2021-03-24T02:41:44.980,"test,model,p"
How to train multiple stacked neural networks alternatively? (Keras),"<python>, <tensorflow>, <keras>, <deep-learning>, <neural-network>",66800787,98,2,2021-03-25T13:45:47.467,2021-03-26T22:59:04.010,"train,model,t"
How to get word embeddings from the trained transformers,"<python>, <tensorflow>, <huggingface-transformers>, <transfer-learning>, <transformer>",66820943,349,0,2021-03-26T16:39:46.217,2021-03-30T08:16:29.877,"get embedding,transformer trained model,m"
"How to feed TensorFlow Datasets into traning_x, training_y, testing_x,testing_y into Keras API?","<tensorflow>, <tensorflow2.0>, <tensorflow-datasets>",66837940,338,1,2021-03-28T02:41:36.647,2021-03-28T07:24:03.257,"feed data,model,m"
"How to pad zeros on Batch, PyTorch","<python>, <arrays>, <pytorch>, <zero-padding>",66848738,195,1,2021-03-29T04:22:31.140,2021-03-29T08:32:56.453,"pad,db,d"
How to train a Keras autoencoder with custom dataset?,"<python>, <tensorflow>, <keras>",66873097,235,0,2021-03-30T14:38:03.147,2021-03-30T15:17:40.300,"train autoencoder,model,t"
How to split duplicate samples to train test with no overlapping?,"<pandas>, <machine-learning>, <scikit-learn>, <pytorch>, <train-test-split>",67016628,228,-1,2021-04-09T07:12:39.877,2021-04-09T22:21:35.070,"split train/test d,ds,d"
How to access a particular layer of Huggingface's pre-trained BERT model?,"<tensorflow>, <keras>, <nlp>",67052427,614,0,2021-04-12T03:46:55.540,2021-04-12T08:24:30.887,"get layer,bert trained model,m"
How to train a neural network to convert integer to roman numbers?,"<python>, <tensorflow>, <machine-learning>, <keras>, <neural-network>",67111344,70,0,2021-04-15T15:26:11.050,2021-04-15T16:39:22.420,"train,model,t"
"how to train model in which labels is [5,30]?","<tensorflow>, <machine-learning>, <keras>, <nlp>, <keras-layer>",67145393,48,0,2021-04-18T05:15:43.950,2021-04-18T06:15:21.823,"train,model,t"
How to load a pre-trained PyTorch model?,"<python>, <pytorch>",67205948,303,7,2021-04-22T02:35:48.807,2021-04-22T04:38:10.330,"restore,trained model,m"
How to train a model with multiple inputs in a batch?,"<python>, <tensorflow>, <machine-learning>, <keras>, <deep-learning>",67211745,47,1,2021-04-22T10:48:02.453,2021-04-22T11:53:32.093,"train,model,t"
How to get the feature maps from each layers of a trained model during inference time?,"<tensorflow>, <machine-learning>, <keras>, <deep-learning>, <keras-layer>",67331114,71,1,2021-04-30T09:05:28.253,2021-05-02T03:16:57.950,"test,layer,p"
"How to save and load nn.Parameter() in pytorch, such that one can continue optimisation over it?","<python>, <pytorch>",67505670,54,3,2021-05-12T14:30:20.763,2021-05-12T17:33:57.093,"restore,dv,d"
How to train new digits handwriting into exist keras model?,"<python>, <tensorflow>, <machine-learning>, <keras>, <handwriting-recognition>",67531649,60,1,2021-05-14T08:56:36.327,2021-05-14T12:55:26.770,"train,model,t"
How to train pytorch model using batches with partial information,"<python>, <machine-learning>, <deep-learning>, <pytorch>, <pytorch-dataloader>",67619611,35,0,2021-05-20T11:40:09.553,2021-05-20T15:58:01.633,"train,model,t"
How to load a saved model defined in a function in PyTorch in Colab?,"<python>, <pytorch>, <torch>, <checkpoint>",67759230,32,0,2021-05-30T08:31:52.220,2021-05-30T16:50:46.393,"restore,trained model,m"
How to randomly initialize layers in trained model?,"<tensorflow>, <keras>, <conv-neural-network>, <tensorflow2.0>",67771706,34,1,2021-05-31T10:03:05.660,2021-05-31T12:29:28.577,"initialize,trained model,m"
How to discard a branch after training a pytorch model,"<machine-learning>, <pytorch>, <autoencoder>",67789463,40,1,2021-06-01T13:07:58.380,2021-06-01T14:51:09.520,"delete branch,statement,m"
How to add the last classification layer in EfficieNet pre-trained model in Pytorch?,"<deep-learning>, <pytorch>, <conv-neural-network>, <transfer-learning>, <image-classification>",68047331,55,0,2021-06-19T13:41:32.327,2021-06-19T14:05:00.743,"add layer,trained model,m"
"How to print every x, y pair used during a Tensorflow training model.fit(X, Y)?","<python>, <numpy>, <tensorflow>, <keras>, <numpy-ndarray>",68115889,58,1,2021-06-24T12:35:32.483,2021-06-24T16:34:51.670,"print training data,data,v"
How to remove training=True from the inbound nodes of a layer in an existing model?,"<python>, <tensorflow>, <keras>, <tensorflow2.0>, <tf.keras>",68265735,46,1,2021-07-06T06:44:06.420,2021-07-06T12:35:12.113,"delete layer,model,m"
How to compare training and test performance in a Faster RCNN object detection model,"<python>, <pytorch>, <object-detection>, <faster-rcnn>",68293253,31,0,2021-07-07T21:40:46.993,2021-07-08T04:47:08.293,"compare,train/test time,e"
How to load a SavedModel downloaded from TFHub as a Keras model?,"<tensorflow>, <keras>, <tf.keras>",68585478,41,0,2021-07-30T04:34:33.607,2021-08-01T14:19:25.880,"restore,trained model,m"
How to test a trained model saved in .pth.tar files?,"<python>, <neural-network>, <pytorch>",68632076,48,0,2021-08-03T07:38:24.387,2021-08-03T10:23:12.793,"test,model,p"
How to make prediction with custom-trained keras model,"<python>, <tensorflow>, <machine-learning>, <keras>",68664900,41,0,2021-08-05T10:29:13.463,2021-08-05T10:47:22.240,"test,model,p"
How to train only RPN for torch vision Faster RCNN with trained backbone,"<python>, <deep-learning>, <pytorch>, <computer-vision>, <torchvision>",68694221,28,0,2021-08-07T16:29:58.793,2021-08-07T16:54:04.623,"tune,trained model,t"
How to update the weight of a model only if loss for current batch is smaller than previous,"<pytorch>, <gradient>, <optimizer-hints>",68703623,32,0,2021-08-08T18:24:57.507,2021-08-09T10:22:21.983,"update,weight,t"
How to know on which GPU tensorflow model is training on,"<python-3.x>, <tensorflow>, <gpu>, <tensorflow2.0>",68767555,33,1,2021-08-13T06:09:50.430,2021-08-13T06:25:08.673,"check used,gpu,r"
How to change the number of classes in pytorch trained model,"<python>, <deep-learning>, <pytorch>, <conv-neural-network>, <image-classification>",68980724,32,0,2021-08-30T08:02:15.443,2021-08-30T08:23:42.940,"change class count,trained model,m"
Tensorflow android demo . How to retrain?,"<android>, <tensorflow>",43723770,673,0,2017-05-01T17:48:45.550,2017-05-02T02:00:03.047,"train,model,t"
How to train a LSTM model with different N-dimensions labels?,"<python>, <tensorflow>, <keras>",45724606,1592,6,2017-08-16T23:49:31.957,2017-08-23T19:54:07.947,"train lstm,model,t"
How to change model parameters in TensorFlow?,<tensorflow>,46528348,1532,3,2017-10-02T15:09:50.670,2017-10-05T15:51:19.703,"change,dv,d"
How to look at the parameters of a pytorch model?,"<machine-learning>, <neural-network>, <pytorch>, <openai-gym>",54259943,208,0,2019-01-18T18:57:26.723,2019-01-18T20:29:05.213,"get,dv,d"
How to train the original U-Net model with PyTorch?,"<python>, <conv-neural-network>, <pytorch>, <image-segmentation>",56764048,1069,2,2019-06-26T01:41:39.033,2019-12-11T10:15:55.767,"train unet,model,t"
How to train features in different scales in deep learning model,"<python>, <deep-learning>, <pytorch>",58525908,60,1,2019-10-23T15:06:20.167,2019-10-23T20:20:31.900,"train,model,t"
How to do retrain a linear regression model with a new subset using tensorflow or keras?,"<python>, <tensorflow>, <machine-learning>, <scikit-learn>, <regression>",65285508,104,-1,2020-12-14T08:05:21.423,2020-12-14T10:49:07.063,"train regression,model,t"
"In pytorch, how to train a model with two or more outputs?","<python>, <machine-learning>, <deep-learning>, <neural-network>, <pytorch>",67071168,70,2,2021-04-13T08:21:40.710,2021-04-13T08:43:46.893,"train,model,t"
How to train a tensor of tensors in PyTorch,"<python>, <pytorch>",67287346,30,1,2021-04-27T16:50:06.283,2021-04-27T17:06:31.467,"train,model,t"
How to do random search for hyperparameters on different GPUs in parallel?,"<python-3.x>, <pytorch>",57189133,312,1,2019-07-24T18:24:34.133,2019-07-24T18:34:12.020,"use multiple,gpu,r"
"GPyTorch, how to set initial value for &quot;lengthscale&quot; hyperparameter?","<kernel>, <hyperparameters>, <gpytorch>",65316550,362,1,2020-12-16T02:40:16.093,2020-12-22T12:40:58.303,"initialize,dv,d"
How to get the hidden states of a fine-tuned TFBertModel?,"<python>, <tensorflow>, <deep-learning>, <nlp>, <huggingface-transformers>",66219090,355,1,2021-02-16T05:26:28.150,2021-02-16T07:03:16.627,"get layer,model,m"
How to apply Drop Out in Tensorflow to improve the accuracy of neural network?,"<neural-network>, <tensorflow>, <deep-learning>",40879504,56616,41,2016-11-30T03:00:39.643,2016-11-30T06:25:57.657,"create,dropout layer,m"
How to compute accuracy of CNN in TensorFlow,"<tensorflow>, <classification>, <convolution>",42607930,13028,9,2017-03-05T11:38:59.057,2017-03-05T11:52:04.037,"compute,accuracy,e"
How to visualize loss and accuracy the best?,"<python>, <tensorflow>, <tensorboard>, <mnist>",44207329,2366,2,2017-05-26T17:39:11.613,2017-05-26T18:34:42.953,"plot training loss,model,v"
How to calculate Pixel wise accuracy in pytorch?,"<image-processing>, <image-segmentation>, <floating-accuracy>, <pytorch>",50773842,2338,0,2018-06-09T11:33:58.340,2018-06-10T13:01:51.803,"compute pixel-wise,accuracy,e"
Keras: How to take random samples for validation set?,"<python>, <tensorflow>, <keras>",52439468,6817,3,2018-09-21T08:16:52.657,2018-09-21T10:07:03.107,"sample valid d,ds,d"
How to plot accuracy curve in Tensorflow,"<python>, <tensorflow>, <matplotlib>",55164505,486,2,2019-03-14T14:02:56.873,2019-03-14T14:23:55.777,"plot accuracy curve,evaluation,v"
How is the keras accuracy showed in progress bar calculated? From which inputs is it calculated? How to replicate it?,"<python>, <tensorflow>, <keras>",56991909,607,1,2019-07-11T14:46:37.130,2019-07-11T15:25:44.833,"print accuracy,evaluation,v"
How to create a variable that persists over tf.estimator.train_and_evaluate evaluation steps?,"<python>, <tensorflow>, <tensorflow-estimator>",57401924,176,1,2019-08-07T20:30:33.617,2019-08-07T21:20:28.300,"create,dv,d"
How to evaluate a Keras multi-class model with Micro F-Measure?,"<tensorflow>, <keras>, <evaluation>, <tf.keras>",60431895,77,0,2020-02-27T11:09:11.067,2020-02-27T11:22:17.207,"compute f1-score,metric,e"
How to get other metrics in Tensorflow 2.0 (not only accuracy)?,"<python>, <tensorflow>, <machine-learning>, <keras>, <tensorflow2.x>",60616842,2277,3,2020-03-10T11:38:01.970,2020-03-22T14:17:47.667,"compute custom,metric,e"
How to check accuracy of LSTM?,"<python>, <tensorflow>, <machine-learning>, <keras>, <lstm>",61163708,214,1,2020-04-11T21:04:58.523,2020-04-18T17:25:55.907,"compute,accuracy,e"
Pytorch: How to find accuracy for Multi Label Classification?,"<deep-learning>, <pytorch>",61524717,2735,0,2020-04-30T13:39:16.113,2020-04-30T14:54:14.950,"compute multi-label,accuracy,e"
Keras how to evaluate a single image once model has been fit,"<python>, <tensorflow>, <keras>",61992707,537,1,2020-05-24T21:36:32.093,2020-05-25T02:00:31.650,"compute for one,accuracy,e"
lstm how to carry out walk forward validation &amp; saving model,"<python>, <tensorflow>, <keras>",62291458,816,1,2020-06-09T20:38:43.723,2020-06-09T20:51:36.407,"compute for epoch,accuracy,e"
How to know my neural network model's accuracy?,"<python>, <tensorflow>, <machine-learning>, <keras>, <neural-network>",62421732,39,0,2020-06-17T04:55:19.500,2020-06-17T05:06:04.667,"compute,accuracy,e"
How to display graphs of loss and accuracy on pytorch using matplotlib,"<python>, <matplotlib>, <pytorch>, <cnn>",63106109,5256,2,2020-07-26T21:52:47.300,2020-07-27T05:06:33.050,"print accuracy,evaluation,v"
How to apply top_k_categorical_accuracy over batch dimension in Keras,"<python>, <tensorflow>, <keras>, <tensorflow2.0>, <tf.keras>",63253271,138,0,2020-08-04T18:46:16.013,2020-08-05T01:00:42.767,"compute top-k in-class,accuracy,e"
How to print Accuracy and other metrics in Tensorflow 2.x?,"<object-detection>, <tensorflow2.x>",63966974,1535,0,2020-09-19T08:53:56.047,2020-10-20T14:28:38.390,"print accuracy,evaluation,v"
How to use cross validation in keras classifier,"<python>, <pandas>, <tensorflow>, <keras>, <scikit-learn>",64160528,755,3,2020-10-01T17:36:22.893,2020-10-10T09:29:55.170,"use cross-validation,evaluation method,e"
How to use K-fold cross validation in TensorFlow,"<python>, <deep-learning>, <tensorflow2.0>",65165279,195,1,2020-12-06T06:17:29.490,2020-12-06T07:38:06.130,"use cross-validation,evaluation method,e"
How to check accuracy on BCELoss Pytorch?,<pytorch>,67288750,204,0,2021-04-27T18:30:14.433,2021-04-27T19:01:53.670,"compute,accuracy,e"
How to plot accuracy with a trained model,"<python>, <tensorflow>, <metrics>",67773921,39,2,2021-05-31T12:39:21.480,2021-05-31T12:41:49.123,"print accuracy,evaluation,v"
How to load and evaluate a CNN using a test set in Tensorflow?,"<python>, <tensorflow>, <machine-learning>, <keras>, <conv-neural-network>",68018762,74,0,2021-06-17T11:50:54.110,2021-06-18T10:20:19.617,"test cnn,model,p"
How to solve constant model accuracy after each epoch,"<python>, <tensorflow>, <keras>, <deep-learning>",68751439,20,0,2021-08-12T04:02:21.913,2021-08-12T04:09:44.390,"compute for epoch,accuracy,e"
How to get the predictation result in csv format from shared variables,<theano>,31935294,122,1,2015-08-11T07:06:23.050,2015-08-11T11:38:20.510,"get,prediction result,p"
How to get predicted class labels in TensorFlow's MNIST example?,"<python>, <machine-learning>, <neural-network>, <tensorflow>, <data-science>",34060332,12648,3,2015-12-03T07:42:20.507,2015-12-04T15:58:24.693,"get,prediction result,p"
How to use word embeddings for prediction in Tensorflow,"<tensorflow>, <word-embedding>",37244708,999,0,2016-05-15T23:21:22.090,2016-05-16T06:47:08.747,"test embedding,layer,p"
How to find wrong prediction cases in test set (CNNs using Keras),"<python>, <machine-learning>, <theano>, <convolution>, <keras>",39300880,9865,18,2016-09-02T21:22:13.663,2016-09-03T06:29:18.710,"find error,result,e"
How to get a prediction from Tensorflow,"<python-3.x>, <tensorflow>",41058131,1177,0,2016-12-09T10:21:13.517,2016-12-09T10:56:36.823,"get,prediction result,p"
tensorflow how to get prediction,<tensorflow>,41116782,11976,4,2016-12-13T08:43:30.383,2016-12-13T09:00:45.840,"get,prediction result,p"
How to output the predicted value(label) in tensorflow MNIST tutorial?,"<graph>, <machine-learning>, <computer-vision>, <tensorflow>, <deep-learning>",41256846,6246,3,2016-12-21T06:56:27.113,2016-12-21T06:59:19.453,"get,prediction result,p"
Theano/lasagne: how to predict with trained model,"<neural-network>, <theano>, <lasagne>",41284752,1153,0,2016-12-22T13:52:22.003,2016-12-23T06:09:51.320,"test,model,p"
How to make a simple prediction in Tensorflow on a trained model?,"<python>, <tensorflow>",41537583,9056,3,2017-01-08T20:35:23.450,2017-01-09T00:58:33.867,"test,model,p"
how to normalize prediction values in tensorflow,"<python>, <tensorflow>",42311607,1185,0,2017-02-18T05:52:32.110,2017-02-18T06:13:22.483,"normalize,prediction result,p"
How to keep tensorflow session open between predictions? Loading from SavedModel,"<python>, <tensorflow>",43701902,11701,12,2017-04-30T01:00:35.020,2017-04-30T06:28:09.983,"restore,trained model,m"
TensorFlow how to output predictions,<tensorflow>,44558094,605,0,2017-06-15T03:37:02.933,2017-06-15T06:06:33.407,"get,prediction result,p"
How to use cloud ML for predictions on csv files rather than json?,"<python>, <tensorflow>, <google-cloud-ml>, <google-cloud-ml-engine>",45243527,720,0,2017-07-21T17:31:33.697,2017-08-23T18:40:24.970,"test,model,p"
How to predict using trained Tensorflow model,"<python>, <machine-learning>, <tensorflow>, <neural-network>",45761584,2892,2,2017-08-18T16:58:12.590,2017-08-18T17:12:34.817,"test,model,p"
how to get percentage of predicted value in Tensorflow Object Detection API?,"<tensorflow>, <object-detection>",45896529,1283,0,2017-08-26T14:35:13.703,2017-08-26T15:05:27.343,"print prediction progress,progress,v"
How to display test images with prediction,"<tensorflow>, <deep-learning>",47254753,995,0,2017-11-12T22:32:15.127,2017-11-13T13:15:51.140,"display tested di,result,v"
How to output tensor flow prediction results in .csv?,"<tensorflow>, <computer-vision>, <deep-learning>",47313589,2944,1,2017-11-15T17:19:00.000,2017-11-16T00:36:20.920,"get,prediction result,p"
How to have predictions AND labels returned with tf.estimator (either with predict or eval method)?,"<python>, <tensorflow>, <tensorflow-datasets>",47349426,4428,8,2017-11-17T11:16:01.453,2017-11-30T13:48:03.470,"get,prediction result,p"
how to write predict_generator output to a file over a loop?,"<tensorflow>, <machine-learning>, <deep-learning>, <keras>, <imagenet>",48165844,1106,0,2018-01-09T10:12:22.987,2018-01-09T12:25:48.323,"convert,prediction result,p"
How to get predictions for one image from the MNIST with TensorFlow?,"<python>, <tensorflow>, <mnist>",48975337,1560,2,2018-02-25T15:47:21.823,2018-02-25T17:18:26.703,"get,prediction result,p"
How to get a single value from model.predict() results,"<python>, <tensorflow>, <machine-learning>, <neural-network>, <keras>",49239478,3189,0,2018-03-12T15:55:33.403,2018-03-12T20:28:06.303,"get,prediction result,p"
How to use LSTM to make prediction with both feature from the past and the current ones?,"<python>, <tensorflow>, <keras>, <lstm>, <rnn>",49245331,167,1,2018-03-12T22:23:25.677,2018-03-13T18:02:17.150,"test lstm,model,p"
How to get predictions on X_test given the DNN?,"<python>, <tensorflow>, <neural-network>, <kaggle>",50180230,68,-2,2018-05-04T17:25:28.343,2018-05-04T17:59:59.423,"test dnn,model,p"
How to use PyTorch to print out the prediction accuracy of every class?,"<python>, <machine-learning>, <computer-vision>, <pytorch>",50355859,3251,1,2018-05-15T17:11:37.837,2018-05-16T08:27:47.613,"print accuracy,evaluation,v"
How to backprop through a model that predicts the weight for another in Tensorflow,"<tensorflow>, <machine-learning>, <backpropagation>, <tensorflow-gradient>",50518569,184,0,2018-05-24T21:40:56.270,2018-05-24T22:02:15.817,"predict,weight,p"
How to print the prediction probabilities in Tensor Flow's retraining example?,"<tensorflow>, <pre-trained-model>",50639216,384,0,2018-06-01T08:31:18.320,2018-06-01T12:43:31.323,"print prediction result,result,v"
How to call a multidimensional prediction on a keras model with a javascript api,"<tensorflow>, <keras>, <tensorflow.js>",50895494,314,0,2018-06-17T09:52:34.023,2018-06-17T10:08:08.890,"test,model,p"
Tensorflow: How to retrieve information from the prediction Tensor?,"<python>, <tensorflow>",51045781,639,4,2018-06-26T14:49:44.667,2018-07-05T08:45:27.830,"get,prediction result,p"
