How to calculate diagonal of a matrix product in Tensorflow?,"<python>, <matrix>, <tensorflow>, <diagonal>",45883971,855,2,2017-08-25T14:44:02.973,2017-08-25T14:53:58.207,"product,dm,d"
TensorFlow: How to embed float sequences to fixed size vectors?,"<tensorflow>, <embedding>, <autoencoder>",45977990,1858,1,2017-08-31T09:29:38.303,2017-09-01T11:55:49.660,"create,embedding layer,m"
How to get output_shape of layer in model with variable input image sizes,"<tensorflow>, <keras>",46007679,1376,3,2017-09-01T20:37:21.730,2017-09-03T16:50:37.563,"get output,layer,m"
TensorFlow: How to get sub array for each row in tensor,"<tensorflow>, <subset>, <tensor>",46046145,644,1,2017-09-05T02:24:13.730,2017-09-05T10:11:34.793,"extract,dt,d"
How to restore a partial graph in tensorflow?,"<python>, <machine-learning>, <tensorflow>, <deep-learning>",46104525,1532,3,2017-09-07T20:22:13.207,2017-09-08T06:21:37.790,"restore,model graph,m"
How to map Iterator's output to placeholder in loss function in Tensorflow using Dataset API,"<python>, <tensorflow>, <dataset>",46156778,1727,2,2017-09-11T13:21:44.753,2017-09-11T13:36:00.023,"compute,loss,m"
How to print all tf.Tensors of a model in a loop?,"<python>, <loops>, <for-loop>, <tensorflow>",46165553,338,1,2017-09-11T23:11:55.833,2017-09-12T11:25:33.157,"display dv,data,v"
How to create a custom Gaussian activation function with Theano to use in a Keras layer,"<keras>, <theano>",46180432,1361,0,2017-09-12T15:33:31.217,2017-09-12T21:21:33.980,"create Gaussian,activation,m"
How to use TensorFlow Dataset API in combination with dense layers,"<python>, <tensorflow>, <deep-learning>",46221420,2810,5,2017-09-14T14:11:26.000,2017-10-18T09:07:35.517,"combine,dense layer,m"
Keras neural network outputting function parameters / how to construct loss function?,"<python>, <tensorflow>, <neural-network>, <keras>, <loss-function>",46227823,317,1,2017-09-14T20:34:02.400,2017-09-14T22:59:08.840,"compute,loss,m"
How to add two layers within a CNTK Sequential,"<python>, <tensorflow>, <computer-vision>, <cntk>",46234319,277,1,2017-09-15T07:44:13.770,2017-09-15T23:15:27.383,"add layer,model,m"
How to concatenate an input and a matrix in Keras,"<python>, <tensorflow>, <keras>",46328084,2630,3,2017-09-20T17:13:44.740,2017-09-20T17:35:57.417,"concatenate,input layer,m"
How to feed input string with shape=[?] to tensorflow model using golang,"<go>, <tensorflow>, <tensorflow-serving>",46378102,1924,1,2017-09-23T09:32:00.323,2017-09-25T10:01:26.787,"feed data,model,m"
How to get the sub tensor from a tensor in tensorflow?,<tensorflow>,46419257,314,0,2017-09-26T06:27:48.813,2017-09-26T06:54:34.210,"subtract,dt,d"
Tensorflow how to increment the dimension of variable,<tensorflow>,46441835,42,0,2017-09-27T07:25:08.777,2017-09-27T08:05:59.917,"increment dimension,dv,d"
How to get weight matrix of one layer at every epoch in LSTM model based on Keras?,"<tensorflow>, <deep-learning>, <keras>, <lstm>",46473823,1184,3,2017-09-28T16:13:40.593,2017-09-28T17:02:00.487,"get,weight,t"
How to change a value of a variable in TensorFlow?,"<python>, <tensorflow>",46563420,2204,0,2017-10-04T11:13:25.053,2017-10-04T11:35:38.757,"change,dv,d"
how to loop over data feeded with a placeholder in tensorflow only one time using the new Dataset API,"<python>, <tensorflow>, <tensorflow-datasets>",46600863,4142,2,2017-10-06T07:50:09.243,2017-10-09T20:18:16.517,"iterate,d,d"
How to specify the correlation coefficient as the loss function in keras,"<python>, <machine-learning>, <tensorflow>, <keras>",46619869,16594,16,2017-10-07T11:59:31.230,2017-10-07T13:33:57.253,"compute,loss,m"
How to convert a scalar tensor to scalar in a model in TensorFlow?,"<python>, <tensorflow>",46633377,1145,0,2017-10-08T16:27:24.727,2017-10-08T20:27:26.387,"convert,dt,d"
How to get value of a tensor from a Tensorflow Mode,"<tensorflow>, <deep-learning>",46634552,55,-1,2017-10-08T18:24:42.113,2017-10-08T19:26:01.967,"get content,dt,d"
How to print tensor shape in tensorflow?,<tensorflow>,46664241,1796,0,2017-10-10T10:16:50.170,2017-10-10T10:53:42.397,"get shape,dt,d"
How to add drop out for the fully connected layer with the TF function fully_connected?,<tensorflow>,46783010,1602,0,2017-10-17T05:24:33.597,2017-10-17T06:54:12.277,"create,dropout layer,m"
PyTorch: How to get the shape of a Tensor as a list of int,"<python>, <pytorch>, <tensor>",46826218,193748,60,2017-10-19T08:59:33.330,2017-10-19T09:29:54.580,"get shape,dt,d"
How to visualize output of intermediate layers of convolutional neural network in keras?,"<python>, <tensorflow>, <keras>, <classification>, <conv-neural-network>",46828476,2421,2,2017-10-19T11:04:47.647,2017-10-19T11:36:33.280,"get output,convolution layer,m"
How to create a variable number of layer in MLP,"<tensorflow>, <neural-network>",46828790,558,4,2017-10-19T11:25:28.097,2017-10-19T12:58:18.750,"create,mlp layer,m"
How to implement L2 regularized cost function for Convolutional Neural Network,"<tensorflow>, <computer-vision>, <conv-neural-network>, <regularized>",46847364,765,1,2017-10-20T10:37:29.790,2017-11-28T08:42:23.457,"compute,loss,m"
How to use an autoencoder to visualize dimensionality reduction? (Python | TensorFlow),"<python>, <tensorflow>, <neural-network>, <embedding>, <autoencoder>",46866208,1840,3,2017-10-21T17:46:39.683,2017-10-23T02:11:07.970,"display output,autoencoder layer,v"
How to perform row wise or column wise max pooling in keras,"<tensorflow>, <deep-learning>, <keras>, <attention-model>",46883334,1294,0,2017-10-23T06:41:33.237,2017-10-23T12:55:31.863,"create,max pooling layer,m"
How to multiply each row of the softmax by a specific matrix in tensorflow?,"<python>, <tensorflow>, <deep-learning>",46892270,200,-2,2017-10-23T14:48:06.970,2017-10-23T15:15:50.957,"multiply,dm,d"
How to calculate percent of error in keras,"<machine-learning>, <tensorflow>, <keras>",47060877,4886,1,2017-11-01T17:52:33.980,2017-11-01T18:08:01.503,"compute error ratio,result,e"
how to set MAPE cost function in tensorflow,<tensorflow>,47097884,1813,1,2017-11-03T14:15:47.143,2018-05-29T08:48:52.057,"compute,loss,m"
how to calculate loss over a number of images and then back propagate the average loss and update network weight,"<backpropagation>, <pytorch>, <loss>",47120126,2736,2,2017-11-05T09:40:34.000,2017-11-07T13:53:59.343,"compute,loss,m"
How to calculate factorial in tensorflow?,"<python>, <tensorflow>, <factorial>",47141359,2020,1,2017-11-06T16:20:34.717,2017-11-06T16:22:42.230,"factorize,d,d"
How to create independent LSTM cells in tensorflow?,"<tensorflow>, <time-series>, <classification>, <lstm>, <rnn>",47150576,380,2,2017-11-07T05:28:18.947,2017-11-07T08:50:44.560,"create,lstm layer,m"
How to get the value of a feature in a layer that match a the state dict in PyTorch?,"<python>, <pytorch>",47260715,1169,1,2017-11-13T09:18:15.740,2017-11-13T15:38:21.910,"get output,layer,m"
How to generate a new Tensor with different vectors in PyTorch?,"<python>, <pytorch>",47267433,64,1,2017-11-13T15:06:56.523,2017-11-13T19:33:50.403,"combine,dt,d"
How to get the category of the object detected - tensorflow,"<python>, <machine-learning>, <tensorflow>, <object-detection>",47279687,1789,2,2017-11-14T07:10:48.280,2017-11-14T08:56:02.900,"get label,prediction result,p"
Tensorflow: How to create confusion matrix,"<python>, <python-2.7>, <tensorflow>, <tensorboard>",47280228,2494,1,2017-11-14T07:45:01.283,2017-11-14T08:53:47.650,"compute confusion matrix,result,e"
"tensorflow, How to index the true value of a tensor?","<python>, <tensorflow>",47323260,721,1,2017-11-16T06:45:17.420,2017-11-16T07:02:48.600,"index,dt,d"
How to select index over two dimension in PyTorch?,"<numpy>, <pytorch>",47374172,2780,4,2017-11-19T06:05:46.663,2017-11-19T11:27:14.830,"select,d,d"
How to feed input with changing size in Tensorflow,"<python>, <python-3.x>, <numpy>, <tensorflow>",47479587,8012,8,2017-11-24T20:23:51.457,2017-12-20T11:49:53.993,"feed data,model,m"
How to (efficiently) apply a channel-wise fully connected layer in TensorFlow,"<python>, <tensorflow>, <deep-learning>, <autoencoder>",47556001,1197,4,2017-11-29T15:12:29.003,2018-01-31T09:19:06.037,"create,fully connected layer,m"
How to repeat array elements to form an nxm dimensional array or matrix,<tensorflow>,47614764,56,2,2017-12-03T02:42:17.243,2017-12-03T07:02:16.327,"repeat,d,d"
How to concat two tensors different shape,"<python>, <tensorflow>",47628682,3504,5,2017-12-04T07:46:35.777,2017-12-04T07:57:57.537,"concatenate,dt,d"
How to mask specific slices for each row in a tensor,"<python>, <numpy>, <tensorflow>",47643285,433,2,2017-12-04T22:51:59.667,2017-12-05T01:04:52.703,"mask,dt,d"
How to get real shape of None (dynamic input shape) in TensorFlow?,"<python>, <tensorflow>",47645298,1436,2,2017-12-05T02:48:46.323,2017-12-05T03:22:14.013,"get shape,d,d"
How to perform element-wise multiplication of two vectors having different dimensions,<tensorflow>,47663784,615,0,2017-12-05T22:36:09.063,2017-12-06T00:28:13.477,"multiply,da,d"
how to get covariance matrix in tensorflow?,"<python>, <machine-learning>, <tensorflow>",47709854,5659,6,2017-12-08T07:44:35.027,2018-04-16T06:14:32.053,"covariance,dm,d"
How to convert a numpy array of tensors to a tensor?,"<numpy>, <tensorflow>",47729628,907,1,2017-12-09T14:32:53.670,2017-12-09T18:54:10.277,"convert,d,d"
How to find index of first matching tensor in a higher ranked tensor,"<python>, <numpy>, <machine-learning>, <tensorflow>",47744964,107,0,2017-12-11T00:28:09.883,2017-12-11T00:31:34.193,"select,dt,d"
How to show hidden layer outputs in Tensorflow,"<python>, <tensorflow>, <neural-network>, <output>, <protocol-buffers>",47787627,6405,6,2017-12-13T07:26:50.537,2017-12-13T10:07:58.290,"print output,hidden layer,v"
"Tensorflow, how to multiply a 2D tensor (matrix) by corresponding elements in a 1D vector","<python>, <numpy>, <tensorflow>, <matrix-multiplication>, <tensor>",47817135,6548,2,2017-12-14T15:41:05.287,2017-12-14T15:48:43.590,"multiply,dt,d"
How to multiply a matrix by a vector in PyTorch,<pytorch>,47870003,19451,20,2017-12-18T13:56:12.547,2017-12-18T15:46:22.927,"multiply,dm,d"
How to restore the function defined in the graph?,"<python>, <tensorflow>",47968556,96,0,2017-12-25T12:20:30.887,2017-12-27T05:57:11.507,"restore,model graph,m"
How to wrap a custom TensorFlow loss function in Keras?,"<tensorflow>, <keras>",48047916,3100,7,2018-01-01T07:33:10.370,2018-01-02T07:04:41.493,"compute,loss,m"
How to use numpy array inputs in tensorflow RNN,"<python>, <numpy>, <tensorflow>, <batch-processing>, <sklearn-pandas>",48115671,1287,1,2018-01-05T14:32:40.627,2018-01-05T15:20:19.157,"input,rnn layer,m"
How to get the class probabilities during the evaluation of CIFAR-10 in TensorFlow?,"<python>, <python-3.x>, <tensorflow>, <machine-learning>, <conv-neural-network>",48127811,424,2,2018-01-06T13:27:19.973,2018-01-06T13:42:46.360,"compute class probabilities,result,e"
How to print confusion matrix in trivial Tensorflow example?,"<python>, <tensorflow>",48150876,1865,1,2018-01-08T13:03:06.840,2018-01-11T14:16:03.233,"display confusion matrix,evaluation,v"
how to scale and renormalize the output with tensorflow softmax_cross_entropy_with_logits for class imbalance,"<tensorflow>, <softmax>, <cross-entropy>",48210729,372,0,2018-01-11T15:37:02.020,2018-02-24T00:27:59.037,"normalize,d,d"
How to initialize embeddings layer within Estimator API,"<tensorflow>, <tensorflow-estimator>",48217599,2030,2,2018-01-11T23:50:52.353,2018-01-13T18:38:21.533,"initialize,embedding layer,m"
How to slice matrices from a 2D matrix along column (vertically) and create a 3D in tensorflow?,"<python>, <matrix>, <tensorflow>, <deep-learning>",48238227,42,0,2018-01-13T08:32:27.543,2018-01-13T10:53:18.057,"slice,dm,d"
How to add slim.batch_norm after custom ops/layer in tensorflow?,"<tensorflow>, <deep-learning>, <tf-slim>, <batch-normalization>, <tensorflow-slim>",48357113,801,1,2018-01-20T14:10:12.103,2018-01-20T16:24:11.467,"create,batch normalization layer,m"
How to use tensorflow to build a deep neural network with the local loss for each layer?,"<tensorflow>, <deep-learning>, <loss-function>",48369202,49,1,2018-01-21T16:46:09.577,2018-01-21T17:18:45.043,"compute,loss,m"
How to find the index of a tensor in a list?,"<python>, <pytorch>",48527722,240,0,2018-01-30T17:58:28.153,2018-01-31T15:34:55.587,"select,dt,d"
How to calculate cost for softmax regression with pytorch,"<python>, <machine-learning>, <deep-learning>, <pytorch>, <softmax>",48549101,528,1,2018-01-31T18:28:39.847,2018-02-01T09:08:45.220,"compute,loss,m"
How to calculate top-k in-class accuracies using TensorFlow Slim metrics,"<python>, <tensorflow>, <neural-network>, <deep-learning>, <tensorflow-slim>",48600929,1240,0,2018-02-03T19:02:11.810,2018-02-12T13:41:56.300,"compute top-k in-class,accuracy,e"
Keras: how to access specific index for multiplication,"<python>, <tensorflow>, <neural-network>, <deep-learning>, <keras>",48611376,1176,1,2018-02-04T18:05:35.400,2018-02-04T20:46:02.483,"multiply,d,d"
How to apply linear transform on a 3D feature vector in Tensorflow?,"<python>, <tensorflow>",48704369,991,2,2018-02-09T10:59:58.010,2018-02-09T11:25:58.493,"linear transform,da,d"
How to print a Tensor Flow variable to 2 decimal places?,"<python>, <tensorflow>",48710409,1832,2,2018-02-09T16:43:43.727,2018-02-09T16:51:20.993,"display dv,data,v"
How to limit loop to specified number of iterations?,"<python>, <tensorflow>, <neural-network>, <conv-neural-network>",48960654,294,0,2018-02-24T07:54:27.733,2018-02-24T09:34:18.103,"iterate,d,d"
How to feed a local placeholder of some function from main function?,"<python>, <tensorflow>",48963438,55,2,2018-02-24T13:35:17.917,2018-02-24T16:43:56.307,"feed,dp,d"
How to mutate Tensorflow Variable in custom Op?,"<python>, <tensorflow>",49074392,357,2,2018-03-02T17:33:43.483,2018-03-05T07:27:34.713,"mutate,dv,d"
How to speed up iterating through an array / matrix? Tried both pandas and numpy arrays,"<python>, <pandas>, <numpy>, <tensorflow>",49172221,257,2,2018-03-08T11:40:25.753,2018-03-11T11:02:54.347,"iterate,d,d"
How to convert array of Integers to binary encoding in TensorFlow or Numpy?,"<python-3.x>, <numpy>, <tensorflow>",49175337,990,1,2018-03-08T14:19:02.327,2018-03-08T15:02:00.223,"convert,d,d"
How to index a 3-D tensor with 2-D tensor in Tensorflow?,"<python>, <tensorflow>",49226523,503,1,2018-03-12T00:17:46.820,2018-03-12T01:06:31.187,"index,dt,d"
How to get the value from a tensor,"<python>, <tensorflow>",49226579,190,2,2018-03-12T00:29:40.520,2018-03-12T19:34:37.670,"get content,dt,d"
How to load/unload a graph from a session in tensorflow,<tensorflow>,49242744,1698,1,2018-03-12T19:04:42.570,2018-03-16T15:33:26.117,"restore,model graph,m"
How to reuse a frozen previously learned subgraph in new computation graphs,<tensorflow>,49268505,617,1,2018-03-14T01:39:48.623,2018-03-15T02:16:25.787,"restore,model graph,m"
How to get a placeholder from a list of placeholders using a placeholder in Tensorflow?,<tensorflow>,49271153,361,0,2018-03-14T06:36:00.480,2018-03-14T08:29:05.187,"get,dp,d"
How to get the default session from a tf.estimator?,"<python>, <tensorflow>",49294329,1617,6,2018-03-15T08:10:41.550,2018-03-15T09:26:00.707,"get,session,t"
How to implement a forward pass in a Keras RNN in real-time?,"<tensorflow>, <keras>, <recurrent-neural-network>",49324093,1107,3,2018-03-16T15:14:31.783,2018-03-16T18:09:17.517,"create,rnn layer,m"
"How to take shape [1,1,256] from [1,4,256] cuda.FloatTensor?","<python>, <pytorch>",49334900,59,1,2018-03-17T10:27:31.947,2018-03-17T18:33:10.680,"convert,dt,d"
How to create a vector from a constant in tensorflow,"<python>, <tensorflow>, <vector>, <tensor>",49349702,959,1,2018-03-18T15:32:39.440,2018-03-18T16:16:47.783,"convert,da,d"
How to add 0.001 L2 weight decay for each layer in CNN?,"<python>, <tensorflow>, <neural-network>, <deep-learning>, <conv-neural-network>",49369472,1582,1,2018-03-19T17:55:41.940,2018-03-19T18:03:09.473,"decay,weight,t"
How to get variables of batch_normalization's mean and variance in Tensorflow,"<tensorflow>, <batch-normalization>",49377158,2890,0,2018-03-20T05:54:08.783,2018-03-21T20:53:33.133,"get,batch normalization layer,m"
How to stop variables from being updated?,"<python>, <tensorflow>, <machine-learning>, <neural-network>",49385147,650,1,2018-03-20T13:11:14.690,2018-03-20T17:54:54.197,"freeze,dv,d"
Tensorflow: How to build a matrix from a dictionary of vectors?,"<python>, <numpy>, <matrix>, <tensorflow>, <concatenation>",49425238,171,1,2018-03-22T09:43:26.110,2018-03-22T09:57:18.853,"convert,dm,d"
"How to correctly give inputs to Embedding, LSTM and Linear layers in PyTorch?","<lstm>, <pytorch>",49466894,16949,37,2018-03-24T16:07:12.230,2018-03-25T06:14:16.173,"feed data,model,m"
How to assign a value to a tf.Variable in TensorFlow without using tf.assign,"<python>, <tensorflow>",49487647,1430,1,2018-03-26T09:03:22.197,2018-03-28T12:09:13.770,"assign,dv,d"
How to initialise weight of a MLP using an autoencoder #2nd part - Deep autoencoder #3rd part - Stacked autoencoder,"<python>, <tensorflow>, <keras>, <autoencoder>",49565638,1495,2,2018-03-29T22:00:24.253,2018-03-30T02:19:59.303,"initialize,mlp layer,m"
how to pad text sequences in R using keras and pad_sequences?,"<r>, <tensorflow>, <keras>",49594691,473,2,2018-04-01T04:05:12.377,2018-04-01T09:43:58.630,"pad,d,d"
How to feed further model parameters along the inputs to Tensorflow Estimator?,"<python>, <numpy>, <tensorflow>, <deep-learning>, <tensorflow-estimator>",49669124,768,2,2018-04-05T09:42:26.390,2018-04-05T11:06:06.040,"feed data,model,m"
How to make a checkerboard matrix in tensorflow?,"<tensorflow>, <neural-network>, <deep-learning>",49675921,273,3,2018-04-05T15:15:16.917,2018-04-08T16:13:28.067,"merge,d,d"
How to extract features from the last layer of slim-tensorflow InceptionNet v3 model?,"<python>, <tensorflow>, <tensorflow-slim>",49677010,918,1,2018-04-05T16:15:34.630,2018-04-05T18:40:42.197,"extract feature,output layer,m"
How to form a sequence of consecutive numbers in Pytorch?,"<python>, <matlab>, <pytorch>, <sequence>",49742625,2763,3,2018-04-09T22:29:51.300,2018-05-03T04:33:06.997,"generate consecutive,d,d"
How to unstack a variable size tensor in Tensorflow?,"<python>, <tensorflow>",49793300,915,1,2018-04-12T09:45:55.897,2018-04-12T11:03:58.430,"unstack,dt,d"
Keras: how to append a vector to a tensor,"<tensorflow>, <keras>, <dimensions>",49798513,2711,1,2018-04-12T13:56:34.097,2018-04-12T14:15:23.757,"append,dt,d"
How to convert from a Pytroch Tensor from mathematically a column vector to a column matrix?,"<matrix>, <vector>, <transpose>, <pytorch>, <tensor>",49847984,1134,1,2018-04-16T00:04:31.363,2018-04-16T06:55:19.980,"convert,dt,d"
How to calculate the distance between a mini batch and a set of filters in PyTorch,"<python>, <python-3.x>, <torch>, <pytorch>",49934624,774,0,2018-04-20T05:31:07.373,2018-04-20T07:14:08.220,"compute distance,db,d"
How to apply a 3x3 filter with a convolutional layer correctly?,"<python>, <tensorflow>, <convolution>",49967737,659,0,2018-04-22T15:41:07.850,2018-04-22T17:26:39.323,"create filter,convolution layer,m"
How to get batched reduce_sum for different range of a big matrix?,"<matrix>, <tensorflow>, <deep-learning>",49977099,53,1,2018-04-23T09:02:02.573,2018-04-23T09:21:52.103,"sum,dm,d"
"How to feed the list of gradients, or (grad, variable name) pairs, to my model",<tensorflow>,50000263,1026,1,2018-04-24T11:13:23.923,2018-04-24T13:39:28.160,"change,gradient,t"
How to get results from custom loss function in Keras?,"<python>, <tensorflow>, <machine-learning>, <keras>, <loss>",50061393,3071,7,2018-04-27T11:25:17.720,2018-04-27T11:36:28.723,"compute,loss,m"
How to apply element-wise rounding function to Keras Tensor?,"<python>, <tensorflow>, <deep-learning>, <keras>",50079766,988,2,2018-04-28T18:25:40.923,2018-04-28T19:14:58.593,"round,dt,d"
How to double the size of a boolean mask with &quot;False&quot;- elements in Tensorflow,"<python>, <tensorflow>",50136192,62,1,2018-05-02T13:44:46.430,2018-05-02T13:52:29.037,"double size,dt,d"
How to perform string find and replace on Tensorflow String Tensor?,"<tensorflow>, <tensorflow-datasets>",50139176,4253,3,2018-05-02T16:16:25.310,2018-05-02T17:20:01.503,"replace,dt,d"
How to calculate the expected values (entry*index) of a tensor for each index,"<python>, <tensorflow>",50199088,78,1,2018-05-06T11:19:42.700,2018-05-06T12:10:33.023,"multiply,dt,d"
How to make Keras have two different initialisers in a dense layer?,"<python>, <tensorflow>, <keras>, <resnet>, <convolutional-neural-network>",50209452,1110,1,2018-05-07T07:51:10.753,2018-05-07T08:50:22.157,"initialize,dense layer,m"
How to implement multi-threaded import of numpy arrays stored on disk as dataset in Tensorflow,"<python>, <tensorflow>, <tensorflow-datasets>",50216747,188,1,2018-05-07T14:34:58.113,2018-05-07T16:18:35.953,"read,d,d"
Tensorflow : How to get tensor name from Tensorboard?,"<python-3.x>, <tensorflow>",50227423,843,1,2018-05-08T06:42:38.710,2018-05-08T08:31:00.983,"get name,dt,d"
How to convert known connected component to adjacency matrix with tensor manipulations only?,"<algorithm>, <tensorflow>, <linear-algebra>, <tensor>",50250724,200,3,2018-05-09T10:08:34.047,2018-05-09T10:34:03.433,"convert,dm,d"
How to check if `compute_gradients` operation has been executed in tensorflow graph?,"<python>, <tensorflow>",50280724,286,0,2018-05-10T20:03:54.843,2018-05-10T20:38:01.817,"get,gradient,t"
How to get stride value in Conv2D layer Tensorflow?,"<python>, <tensorflow>, <machine-learning>, <conv-neural-network>",50291549,476,1,2018-05-11T11:39:33.813,2018-05-11T11:58:54.530,"get stride value,convolution layer,m"
How to create a channel sensitive loss function?,"<python>, <recursion>, <tensorflow>, <keras>, <autoencoder>",50297594,229,0,2018-05-11T17:44:09.437,2018-05-11T18:08:05.117,"compute,loss,m"
How to divide by the size of a vector in Tensorflow to compute an average loss like MSE?,"<python>, <tensorflow>",50299831,260,1,2018-05-11T20:28:47.787,2018-05-11T20:36:12.623,"compute,loss,m"
How to apply a computed loss to a graph?,<tensorflow>,50301754,51,1,2018-05-12T00:18:13.123,2018-05-12T02:18:28.530,"compute,loss,m"
How to make a de-convolution layer in tensorflow?,"<python>, <tensorflow>, <deep-learning>, <convolution>, <deconvolution>",50307579,625,0,2018-05-12T14:59:27.853,2018-05-12T15:24:07.787,"create,deconvolution layer,m"
how to add more layers to the following keras architecture?,"<tensorflow>, <keras>, <lstm>",50310507,678,0,2018-05-12T20:42:51.690,2018-05-12T22:11:16.777,"add layer,model,m"
How to extract name from tf.contrib.layers.fully_connected(),"<python>, <tensorflow>",50328921,322,0,2018-05-14T11:13:17.137,2018-05-14T11:55:39.553,"get name,fully connected layer,m"
how to normalize input data for models in tensorflow,<tensorflow>,50346017,31599,17,2018-05-15T08:53:01.537,2018-05-15T12:50:09.343,"normalize,d,d"
How to implement the 0.5*||euclidean_norm||^2?,"<python-2.7>, <tensorflow>, <gradient>, <euclidean-distance>",50354030,53,0,2018-05-15T15:30:08.733,2018-05-15T17:12:31.197,"compute,loss,m"
How to loop through setting different variables to a function's output?,"<python>, <list>, <pandas>, <tensorflow>",50360760,108,2,2018-05-16T00:10:05.117,2018-05-16T00:58:13.557,"iterate,dv,d"
How to compute the cosine_similarity in pytorch for all rows in a matrix with respect to all rows in another matrix,"<machine-learning>, <neural-network>, <pytorch>",50411191,14681,16,2018-05-18T12:18:01.377,2018-05-19T14:26:14.843,"cosine similarity,dm,d"
How to save variable in custom layer in keras,"<tensorflow>, <keras>",50427291,1413,1,2018-05-19T16:24:04.853,2018-05-19T19:02:53.767,"save,layer,m"
How to reshape a tensor to the shape of a placeholder?,<tensorflow>,50432605,816,1,2018-05-20T07:24:52.567,2018-05-20T10:58:21.243,"reshape,dt,d"
"In eager mode, how to convert a tensor to a ndarray","<python>, <tensorflow>",50459267,2057,2,2018-05-22T03:18:00.880,2018-05-22T03:37:33.943,"convert,dt,d"
PyTorch : How to properly create a list of nn.Linear(),"<python>, <pytorch>",50463975,7352,19,2018-05-22T09:15:18.027,2018-05-22T09:57:07.600,"create,layer,m"
How to plot Tensor flow activation functions in a range of inputs,"<python>, <tensorflow>, <plot>, <representation>",50474674,368,0,2018-05-22T18:55:35.270,2018-05-23T04:57:51.430,"plot activation,model,v"
How to Slice tensor variables dynamically,"<python>, <tensorflow>",50523482,219,0,2018-05-25T07:14:36.360,2018-05-25T07:54:02.140,"slice,dt,d"
How to create mask tensor in tensorflow?,"<tensorflow>, <machine-learning>, <deep-learning>",50524491,1164,0,2018-05-25T08:11:50.660,2018-05-25T08:48:02.287,"mask,dt,d"
How to create a parallel linear computation in one layer with TensorFlow?,<tensorflow>,50526842,132,1,2018-05-25T10:15:11.080,2018-05-25T10:28:10.573,"create,layer,m"
How to map function to weight tensors of variable shapes in tensorflow,"<python>, <tensorflow>",50533610,170,0,2018-05-25T16:39:47.387,2018-05-25T19:41:29.820,"compute,loss,m"
tensorflow-How to do conv2d_transpose with variable images' size?,"<python>, <tensorflow>",50577055,146,-1,2018-05-29T05:43:29.767,2018-05-29T23:18:21.263,"transpose,convolution layer,m"
How to combine embedded columns with other input data in Keras,"<python-3.x>, <tensorflow>, <keras>, <embedding>",50639501,1350,2,2018-06-01T08:48:16.183,2018-06-01T10:16:04.333,"combine,d,d"
How to create a tensorflow dataset from a DataFrame with vector columns?,"<python>, <pandas>, <dataframe>, <tensorflow>",50641588,5974,4,2018-06-01T10:39:08.007,2018-06-01T16:16:51.047,"convert,d,d"
How to know Tensorflow Lite model's input/output feature info?,"<machine-learning>, <deep-learning>, <tensorflow-lite>, <firebase-mlkit>",50646958,4574,7,2018-06-01T15:40:45.773,2018-06-01T21:34:26.960,"get input/output,model,m"
